{"accepted_by":null,"artifact":{"byte_size":12918097,"media_type":"directory","modified_at":"2026-09-01T07:01:36.367789Z","relative_path":"reports/B/v-real-b-pnh-20260901/html","sha256":"79236f88363dc544726d4eff61a83304c5b71612827c1e626e00047786cdd607"},"chart_ids":["efficacy-comparison","safety-heatmap","efficacy-safety-matrix","baseline-comparison","trial-disposition"],"claim_ids":["claim_1129f360e6ba9b9151de42be","claim_3b3d027cb08cf1c5fda144a1","claim_81bd5ebd6133e0aa9ab3dbf0","claim_4593895f8583a91db51927fa","claim_a6727846edcf27e4e5f5ed35","claim_2b0fdb92fb7ccdf9daadac38","claim_a291be265d4bc29fd74d8cec","claim_56cecf23a48726c2d422f56c","claim_613ce56cef220f62d28d2f10","claim_7cad42a4f8fea09b82f9fc42","claim_be3a49ec0a5b14410a06fc35","claim_1d3c8e2a3fbd1c2a0d2dbc8b","claim_428f74ecd8c0b0ea0ce5ee50","claim_531fa623134364263c5982ec","claim_fcecbfa05c74de75465b2504","claim_26200a56889e0882a00c82ce","claim_f418aba07341d3b9b9d0e395","claim_9b579d822897fbcb8ed272fa","claim_bbe74e86e88fa6ef19506fcd","claim_133af7b922e2c78867b5045b","claim_ff1dbb728d62d533693fc63c","claim_25b06899cb57764783d991ba","claim_b48858b35a7a6838a76e79e8","claim_406c1c15d251249b8f2fe4f9","claim_b4c80d7aa8488ed857e14aa6","claim_16e0e3fb869afec701ebc713","claim_f8c4fa3b78999ed1c404ed80","claim_c368a28666c635035f38dd7c","claim_2bb7e360ed8dc85af5c7461d","claim_2e3c4e4ad5e1afb20a1e7098","claim_67837c59b8d11525898c03e8","claim_bb39fd00638eba824905e000","claim_f8ddf0a0aa7966de5b345be8","claim_0f90d891cd33a83881301ec2","claim_063b134cdced926883454cb2","claim_72702c78de6c4561f6be9735","claim_5d16969fb39df3e725a67124","claim_8d03aa0b8aea851dc9e6ef4c","claim_55f4f3f8dd81af63be9619d4","claim_6eb1ad27be3138be1748f4a3","claim_dd341edac19d5ea0bfccde6e","claim_f1a17969f393a7b470b3c77f","claim_3b5334ef2e505095f0803027","claim_ce2d77c0a36cb86832b4ef46","claim_70c73f6838e7b6eaf3c6a2a3","claim_522973bb2594e8240d4e1101","claim_0bbb52e00f9b4581713f077b","claim_9911308b52cb6f78355c9b56","claim_197fc3b1af551bc6bae39570","claim_ac6dc79fd4898da04b01ca78","claim_dbb34743f042bf19cff17e00","claim_1bb7b67b314a30394e9316c9","claim_578ba0ee7d0dfa10f295a81a","claim_b39e4ff5b05b2df9b8b87e3e","claim_7d45ef1c0e1b5bfe0d8487f0","claim_342d6fc872e0c3fa89d628d4","claim_7afe6e4550151ba6f8dbd932","claim_37d25fd13989d9edecab2aec","claim_5f13389ae18b23a8ea738904","claim_5ea086bcc183752ee79eff65","claim_c7ccacd571a8f533b93d20e7","claim_899bfee2911b6646d9143434","claim_01e4360e00d30b4695ba2608","claim_b1ec23151d49eec075ddbb74","claim_3ff0ad09e9723b7d71a5a19c","claim_4a2f6eab54056721d7f5c44e","claim_5a7af123877d9af903aaf7da","claim_e4e8a24acbb9cc7e60a3e646","claim_14f8bfc2c2aea99137cba9c5","claim_d1f66100e0299e1997e8f0e4","claim_be60816d642724ab3b26e3a8","claim_b6092ac132116eee9d490cfb","claim_e5e40a2d34b924c72ff25939","claim_456b307437ec6890663b741e","claim_fcd11e5cdc2bec642d62c692","claim_2630fcc62f0ecde4eb5eac2a","claim_593065fea8849e0c7f1a9b32","claim_a5967975f724c2bd25f9f6cd","claim_e1dd59c07c97e96b67511467","claim_c9aaaabdbc4293ba16db57e3","claim_64d56a2ddbc6fc42584db9e9","claim_9d12e8d39e37644298148d13","claim_30a01b0175afc660650132ea","claim_805c691af32c95d88c7d130c","claim_a6f216df7bcce635b69f2ea0","claim_6cf9bcc673d491d060ff0601","claim_a10ce71138dbb5dd3187fe81","claim_a2ec3b01bee253b5b85c0c4b","claim_4c3340f1022c07667171a76d","claim_c2a9d5c61a38e5448c88f02f","claim_9fe60e638fd4a288657bbc3c","claim_780043023a8f226c99166452","claim_f15b49a5a4dbea9550b52506","claim_68c48595cb4983ae17fa2478","claim_ceaf3649333e1d30344145c9","claim_3464102de29e6db5694f96e1","claim_b446dd26cf7afc0b90e4282f","claim_b8378b9b0956a7180ff5d378","claim_3324f9bb196251078b9a4188","claim_72687c7b7572d871404af3f8","claim_001a407e6b6be6726e88c37f","claim_425c6069cc4677be4259bc74","claim_13853e46635fab85baa939fc","claim_dc3be206ceec45c6d5416530","claim_676732be805178efe882ebd2","claim_0011a9d3c5e824ef6392b3d7","claim_dea07672bcd41fd8291685c3","claim_3601cd1107db264a48d3f46c","claim_00197c7cd83de03d74302ebf","claim_1cff126a956523ff09b6acca","claim_755ac2c02ed1f8c7af703f26","claim_806cc4d734cfb91965a4caf4","claim_7c369e5cbb837e1ed2b6537f","claim_b3d3fec22331f0482383893c","claim_df747830d0209f3911878a83","claim_1c5749bd90a775c553d150df","claim_845e8e0d2da71b667d4f87a2","claim_b348fa70320ae7ce68349948","claim_52ce31fdf826c964de8eae99","claim_730c4e1c2b0256b6b6618d95","claim_66d9f0a7a84a6af802687ea3","claim_9bacd8d6496f9e29b2759994","claim_bf8057ece1170ba0c5d2384f","claim_d9b36a9d2ed9914d36ce7eaf","claim_b10c63ff3052954dd0155aeb","claim_80a07b2ca013d2249aca26cb","claim_22d1ed077883f94f67e7c208","claim_b547a72ea9f1f1acdc714922","claim_61451eaf7a7210e085409b8f","claim_1e4af199e14712a5eeed5d2e","claim_c0a262fef713510d8f112f8e","claim_2a1ebfddfee8824e6115eccb","claim_6e02ba13f38fb708ec66b16e","claim_7d4b6ee3deab9dcb3637947e","claim_0980b4bec19fbc0a77f600df","claim_828b18fef84de7a3ec7c0ba6","claim_10855d5b71fe9eca804ac4c2","claim_93cd2204b645d455f8e10036","claim_96b64ea83fa8e4e9dc027e5d","claim_1012399a7a14ddc249d09d2f","claim_59db87783ba554ff92efc23f","claim_39fd03ee144bc58653099a3c","claim_b86891f09c733313bc5997e7","claim_a8dca74c9854ce4681ee2e1f","claim_8b43d3d778db95e4a4af067f","claim_f4c0723fde710100004a5ab3","claim_76eda483820d3e284171cb2d","claim_18a9d351804fa3ed7e9ce0a5","claim_feb23294d1d8f1337119292b","claim_32e51356fff6493ae5ece919","claim_d6b4eaf4f98f475b4867e785","claim_d9a204e620f81b289eb5d898","claim_611c3032eeed37d8418bf909","claim_f9502e20d84cf3c9b193e243","claim_c401fe9d021d7d81dfaea13a","claim_b30016af952bc54f5c4c633d","claim_9b85003e4aa4c2344e87717d","claim_f6ba2a3782136f84aea1d53d","claim_1590e782cd4c000a7281599f","claim_fd905cae75ff7aa2a85c5ac5","claim_a0bafa02cbd54b6d528092f4","claim_bbd27e4f0d0efb295ff4a39f","claim_ea67554497875525e9553d83","claim_896410ca451538a729cb1a6e","claim_5d7b1ec099d935896fd5a104","claim_d1edd93d17b41d2511b46cd6","claim_29c9de5608e43c5fb36f3b06","claim_7f9549d92842dc1d77f6cf96","claim_17b55d94b3b86e5e1c858b54","claim_7b310b6447481ee4181b14ce","claim_c2a6ed27db05e2a9c228b3e3","claim_19577531b9728e69ae529a35","claim_511db8e40b0ea98f200e5690","claim_f2455ffc0d707bca5309b65f","claim_f098b0ce330eef4057955026","claim_2efe3306dc262ba846d4c4ef","claim_c01815d73aa2968561bfb20d","claim_5a58dc554318f1c29d8aa711","claim_a8623d470f21e9569110e1ed","claim_4726463674740c1b89f4756e","claim_be982a782abb8f2bd160fdb5","claim_2ad844f7f7524d4ab7548dd9","claim_fbdf9572f7ff3051cede4118","claim_ad85d289aa425865290ea6a4","claim_cf4e9841453f4497fff27d32","claim_9f811e63fe44875914615ab8","claim_a501e3fd2ee8991ded4e73db","claim_bc3003e4a9074f7c191726cb","claim_e985059471c423de1855114c","claim_c60a45171bd1f98c2e45f0ac","claim_d19d4e267adcc6ad36572099","claim_fe2ef06d8f838873dc57157b","claim_02b48aff2094847d69a10572","claim_4821666c15fb2496f68b92fb","claim_e0c0f83d7c8b5780abc0a0d8","claim_a9347b816c9ef06e9ea2872b","claim_0b9ed9d6ab3ab0ae2e832b63","claim_5ad4340ddcca372c96d86ed0","claim_8bd45926bf20513ea50b53b8","claim_e5ceb81bbd6eeb92cbd0fed2","claim_c593cd61a93f1f097b52d9ee","claim_ddc5b0a845e667b91ce23eff","claim_3b26d15849c07b65cd2339ac","claim_11784b9735152442ba48fd79","claim_2505ce602b3de014ba713518","claim_aa6bc6985ca7f14f5a56ff1e","claim_9a811727b5be3f858d7ee6d7","claim_887c3dedbeb708d35596c568","claim_1fe899d5972da0c1eef9c1de","claim_b3cb4d9835e6c41cb1d6461d","claim_daf31ebda50b2e1d80092709","claim_86d87bab6afd610241a1d4b4","claim_2fa937d756d755b46a3d58a3","claim_85846d4edfef09f90cf3b97f","claim_151d75a79640528c025546de","claim_ac07efff1b0e968b1a856005","claim_c4c1dbfee2a36ec94ff316cd","claim_29c0ad547b8f6f6e1f06efcc","claim_4f6f9d45c85d6bb0670476ab","claim_ff208ae74508eb9cbb84399a","claim_2347daff911d1eec1c9c8ec0","claim_1a11d8aad29b7f6319cd54f8","claim_cc98409ecfd594b054c30829","claim_ca176129adc1210d9775f4f9","claim_06e8bb8d6947bff88e091c1c","claim_5fd1da7d5af674996a9f4576","claim_79bf84404b5eb553798d642e","claim_4d60e747bebc43e39ce39e73","claim_b76dc64a3b701bb6fc433f13","claim_1a595b71bd59f9d09d54c8ff","claim_76aad640c9f99013cd7316a5","claim_aa2fc6e4dd87c4f4653bf5b5","claim_a7ad1d82e3864f0fc0cefddb","claim_e1e567c110a28895dd8a598a","claim_276169285f7bd298caf2c5d5","claim_ff1e64344feb2c9d8be756a2","claim_c1c20c3344142d828fca7664","claim_a200e44f0ac2c0284eccd46b","claim_8eb5fe1ae30f2a2598cb23ab","claim_8431ca75225ae2492b395dca","claim_e34df30a91e5cde0bb6cbbdd","claim_fa4ff5a39f256d8c8dc98939","claim_46ef7a06534be0c759e3f74f","claim_26fe416f20b100d8e2f77d70","claim_40aeaca43eb5933c9d896e5e","claim_60887a616fde7b787e9a71c0","claim_788642a67cedd15b5e68258c","claim_934ed5d2280422ec6b7f3f2c","claim_b7ea41e349867c9ae88f26d9","claim_6c654d18ef655d8f9732a09a","claim_b4e16267e7b5e1cbb797142a","claim_0eb51f81adddfde11df7ba0c","claim_4f80dafe869c5df0312b3772","claim_9b0f5411ed9a9329d0a30187","claim_21c2f2bb46ca8271fb6abdac","claim_705981fe9adba601eb5c5537","claim_61a3c825d9c149f1a63fe416","claim_d7a04eadb13d848309970c63","claim_350cebba5cb955db85147dce","claim_35f39875e9d8d00d67171f57","claim_dc9edbb9a19b8c0e18c28baa","claim_e5662f8ede5a3145d8063cb7","claim_967cd279fd5046a814afc811","claim_6bdbd77be85cae07b313f972","claim_73feda9ac392dfb55ad1d4c8","claim_50387368654f51b44e3c2b7e","claim_5c34e3a3723e890224ba6bec","claim_c92e6099031bcf9bcd68ab03","claim_8b58c602499ae8b064980384","claim_2c9f4a43d9baef4861589c31","claim_0fa397246eb5551d039edba2","claim_3648bb7165f64cb9c658b28e","claim_435b5907a1f27b776345c37c","claim_e0db8b620bfe581ce6a63653","claim_0578c31e2f0f3b95798d7a29","claim_3d56598f67b1884c579c8348","claim_e4fcbeb71a728e64f72d81fc","claim_73fa6bcb5f844a3068986ec1","claim_0ae4576f39dcf22b375c975e","claim_b054d4cf6a066f2a40f132b7","claim_a53b211a3c7e1da7a3a93b28","claim_e3f50d816c4286f299a8a8bc","claim_8436ad1bb6386fac32882c4a","claim_72ae2522caf569b5a57f76d5","claim_0ff37db211924d6604c8611b","claim_ed06847a8ad484b4c5ef53f6","claim_cc0bb0e05e58ae183ef9d3fa","claim_c794ebc627405169fc269f58","claim_0cfd0f3d733aaff085bf0066","claim_863ffa0dc878ee382531ff5c","claim_e503a2dc6694d97741b50ffc","claim_a1e